{
  "schema_version": "review_event.v1",
  "event_id": "7c9d0e1f-3b4a-4c5d-9e8f-2a3b4c5d6e7f",
  "event_type": "review.completed",
  "occurred_at": "2026-10-26T10:06:30Z",
  "producer": "gcp-reviewer-agent",
  "change": {
    "repo": "drecoder/genesis",
    "pr_number": 42,
    "head_sha": "3f66082a1b2c3d4e5f60718293a4b5c6d7e8f901",
    "task_id": "msg-001",
    "spec_id": "spec-2026-0042",
    "spec_version": 3
  },
  "round": 1,
  "object": {
    "uri": "s3://drecoder-factory-reviews/findings/drecoder-genesis/42/3f66082a/round-1.json",
    "sha256": "sha256:2b2b2b2b2b2b2b2b2b2b2b2b2b2b2b2b2b2b2b2b2b2b2b2b2b2b2b2b2b2b2b2b",
    "size_bytes": 9216,
    "media_type": "application/json"
  },
  "outcome": {
    "status": "findings",
    "blocking_findings": 1,
    "escalations": [
      "review:human-required"
    ]
  }
}
